[
  {
    "version": "0.1.0",
    "date": "2024-06-01",
    "startup_local_p50_ms": null,
    "startup_local_samples": null,
    "cold_start_p95_ms": null,
    "stripped_bytes": null,
    "loc_handler": 28,
    "quality_gates": {
      "fmt": true,
      "lint": true,
      "complexity": true,
      "coverage_pct": null,
      "mutation_score_pct": null
    },
    "competitor_refs": null,
    "notes": "Release inicial. cold_start e stripped_bytes não medidos formalmente; benchmark_ci.sh não existia ainda."
  },
  {
    "version": "0.1.1",
    "date": "2024-10-01",
    "startup_local_p50_ms": null,
    "startup_local_samples": null,
    "cold_start_p95_ms": null,
    "stripped_bytes": null,
    "loc_handler": 28,
    "quality_gates": {
      "fmt": true,
      "lint": true,
      "complexity": true,
      "coverage_pct": null,
      "mutation_score_pct": null
    },
    "competitor_refs": null,
    "notes": "Patch de manutenção. Métricas de binary size e cold start não coletadas (release sem tag git — ver CHANGELOG)."
  },
  {
    "version": "0.1.2",
    "date": "2025-05-01",
    "startup_local_p50_ms": null,
    "startup_local_samples": null,
    "cold_start_p95_ms": null,
    "stripped_bytes": null,
    "loc_handler": 28,
    "quality_gates": {
      "fmt": true,
      "lint": true,
      "complexity": true,
      "coverage_pct": null,
      "mutation_score_pct": null
    },
    "competitor_refs": null,
    "notes": "Patch de manutenção. Métricas de binary size e cold start não coletadas (release sem tag git — ver CHANGELOG)."
  },
  {
    "version": "0.2.0",
    "date": "2026-05-16",
    "startup_local_p50_ms": 15,
    "startup_local_samples": 1,
    "cold_start_p95_ms": null,
    "stripped_bytes": 3549712,
    "loc_handler": 13,
    "quality_gates": {
      "fmt": true,
      "lint": true,
      "complexity": true,
      "coverage_pct": null,
      "mutation_score_pct": null
    },
    "competitor_refs": null,
    "notes": "Coletado automaticamente por metrics_append.sh. Valor de startup medido em amostra única (pré-ADR 0008); cold start de Lambda nunca foi medido por este script."
  },
  {
    "version": "0.3.0",
    "date": "2026-05-17",
    "startup_local_p50_ms": 12,
    "startup_local_samples": 1,
    "cold_start_p95_ms": null,
    "stripped_bytes": 3549224,
    "loc_handler": 13,
    "quality_gates": {
      "fmt": true,
      "lint": true,
      "complexity": true,
      "coverage_pct": null,
      "mutation_score_pct": null
    },
    "competitor_refs": null,
    "notes": "Coletado automaticamente por metrics_append.sh. Valor de startup medido em amostra única (pré-ADR 0008); cold start de Lambda nunca foi medido por este script."
  },
  {
    "version": "0.4.0",
    "date": "2026-09-13",
    "startup_local_p50_ms": 10,
    "startup_local_samples": 1,
    "cold_start_p95_ms": null,
    "stripped_bytes": 3550744,
    "loc_handler": 13,
    "quality_gates": {
      "fmt": true,
      "lint": true,
      "complexity": true,
      "coverage_pct": null,
      "mutation_score_pct": null
    },
    "competitor_refs": null,
    "notes": "Coletado automaticamente por metrics_append.sh. Valor de startup medido em amostra única (pré-ADR 0008); cold start de Lambda nunca foi medido por este script."
  },
  {
    "version": "0.4.1",
    "date": "2026-09-13",
    "startup_local_p50_ms": 11,
    "startup_local_samples": 1,
    "cold_start_p95_ms": null,
    "stripped_bytes": 3550112,
    "loc_handler": 13,
    "quality_gates": {
      "fmt": true,
      "lint": true,
      "complexity": true,
      "coverage_pct": null,
      "mutation_score_pct": null
    },
    "competitor_refs": null,
    "notes": "Coletado automaticamente por metrics_append.sh. Valor de startup medido em amostra única (pré-ADR 0008); cold start de Lambda nunca foi medido por este script."
  },
  {
    "version": "0.4.2",
    "date": "2026-09-13",
    "startup_local_p50_ms": 18,
    "startup_local_samples": 5,
    "cold_start_p95_ms": null,
    "stripped_bytes": 3550128,
    "loc_handler": 13,
    "quality_gates": {
      "fmt": true,
      "lint": true,
      "complexity": true,
      "coverage_pct": null,
      "mutation_score_pct": null
    },
    "competitor_refs": null,
    "notes": "Coletado automaticamente por metrics_append.sh. cold_start_p95_ms (Lambda ARM64 128MB) exige invocação real na AWS — ver ADR 0008."
  },
  {
    "version": "0.5.0",
    "date": "2026-09-26",
    "startup_local_p50_ms": 43,
    "startup_local_samples": 5,
    "cold_start_p95_ms": null,
    "stripped_bytes": 3693672,
    "loc_handler": 13,
    "quality_gates": {
      "fmt": true,
      "lint": true,
      "complexity": true,
      "coverage_pct": null,
      "mutation_score_pct": null
    },
    "competitor_refs": null,
    "notes": "Coletado automaticamente por metrics_append.sh. cold_start_p95_ms (Lambda ARM64 128MB) exige invocação real na AWS — ver ADR 0008."
  }
]
